{
  "schemaVersion": 1,
  "packetId": "anotherlife-realm-creature-production-source",
  "sourceVersion": "al-rcreature-2026-09-03-v003",
  "createdAtUtc": "2026-09-03T08:52:26Z",
  "authority": {
    "finalCreativeApprover": "user",
    "approved2DSourceVersion": "anotherlife.creature-2d-approved-source.v2",
    "runtimeAuthority": false,
    "gameplayAuthority": false,
    "narrativeAuthority": false
  },
  "readiness": {
    "technicalPacketState": "TechnicalReviewReady",
    "userCreativeState": "ApprovedSourceVersion",
    "runtimeIntegrationState": "Blocked",
    "narrativeNamingState": "WorkingLabelsOnly"
  },
  "qualityBar": {
    "style": "mystical medieval naturalism",
    "authoringTextureIntent": "8192x8192 native base color and 4096x4096 native normal/roughness/metallic for approved hero/elite production sources; 2048x2048 runtime maps are derivatives",
    "ownerTierTexturePackets": 3,
    "belowOwnerTierTexturePackets": 18,
    "coverageDisposition": "Hollowbark Stalker, Reliquary Basilisk, and Cindermaw retain complete owner-tier authoring maps. Cindermaw now binds a smoothed v004 source to authored anatomy-weighted macro plate, mid-scale pebble, and fine-pore tangent normal detail. Mere-Root and Crownstep require topology-matched texture rebuilds; all other lower-tier packets remain review sources.",
    "runtimeVfxSeparate": true
  },
  "provenance": {
    "generatorProduct": "Meshy",
    "generatorModel": "Meshy-7",
    "taskBinding": "Each model records the Meshy task ID or IDs used for its selected candidate/rebuild.",
    "exactGenerationPromptState": "not_retained_in_this_packet",
    "promptDisposition": "Approved 2D sheets and their recorded requirements are authoritative inputs; exact Meshy 3D request payloads were not retained as a complete immutable prompt ledger, so this packet remains TechnicalReviewReady rather than TechnicalHandoffComplete.",
    "externalInputs": [
      {
        "kind": "AnotherLife owner-approved 2D creature source",
        "thirdParty": false,
        "record": "realm_creature_2d_approval_manifest_v002.json"
      }
    ],
    "editingSteps": [
      "Meshy candidate generation from approved 2D source evidence",
      "Blender structural inspection and candidate selection",
      "PBR packet retention; premium procedural map rebuilds for Hollowbark, Reliquary, and Cindermaw",
      "Fail-closed review disposition with superseded/failed outputs excluded",
      "Approved DCC geometry repairs and structural re-audit for five blocked packets",
      "Cindermaw Meshy-7 retexture, triangulated non-overlapping UV rebuild, and tiled 8K/4K rebake",
      "Independent hash, UV, schema, and fail-closed readiness validation",
      "Cindermaw v004 deliberate-angle smoothing and anatomy-aware authored 4K tangent-normal detail"
    ],
    "licenseEvidence": "Generated through the project owner's Meshy account from AnotherLife-approved source evidence. No third-party source image is declared as an input. This is an evidence statement, not a universal legal-clearance claim.",
    "editableSourceAvailability": "FBX and image maps are retained for all selected sources; versioned Blender geometry, UV, smoothing, and normal-detail sources plus hash-bound DCC reports are retained for the remediated packets. Rigs remain undelivered."
  },
  "unityImportBoundary": {
    "path": "outside_unity_assets",
    "metaFilesRequired": false,
    "importSettingsRequired": false,
    "reason": "Models and textures are retained under unity/ArtSource and review media under unity/Docs; neither tree is imported by Unity. A separate runtime integration PR must create Unity Assets, .meta GUIDs, importer settings, LODs, rigs, and packaging evidence."
  },
  "lodPolicy": {
    "sourceTierMaximumTriangles": 75000,
    "balancedLodMaximumTriangles": 45000,
    "lowMobileLodMaximumTriangles": 22000,
    "requiredDerivatives": [
      "LOD1",
      "LOD2"
    ],
    "deliveryState": "Blocked_not_generated_or_validated"
  },
  "summary": {
    "approved2D": 21,
    "structuralPass": 21,
    "blocked3D": 0,
    "ownerTierTexturePackets": 3,
    "belowOwnerTierTexturePackets": 18,
    "runtimeIntegrationState": "Blocked"
  },
  "models": [
    {
      "source2dId": "tdf_boss_stonehold_fault_crowned_colossus",
      "modelId": "boss_stonehold_fault_crowned_colossus",
      "status": "clean_textured_base_pass",
      "blocker": null,
      "selectedSource": {
        "path": "Models/boss_stonehold_fault_crowned_colossus/boss_stonehold_fault_crowned_colossus_source_v001.fbx",
        "bytes": 14532732,
        "sha256": "c06b9fc23316f6d40ff747e1bdf12b4a055633530d6dd036909a3bc2f83d70f6"
      },
      "textures": [
        {
          "path": "Textures/boss_stonehold_fault_crowned_colossus/ao.png",
          "bytes": 6988,
          "sha256": "12c77e4a41a055f618d9aa992c2950d8366a5b2cb554644eac215f5e814c8358",
          "dimensions": [
            2048,
            2048
          ],
          "mediaType": "image/png"
        },
        {
          "path": "Textures/boss_stonehold_fault_crowned_colossus/base_color.png",
          "bytes": 5453047,
          "sha256": "3b15b1ef953f8f60b860ccc87ac62a710cbe0f40f6e460cb5bd9d3696f37adbc",
          "dimensions": [
            2048,
            2048
          ],
          "mediaType": "image/png"
        },
        {
          "path": "Textures/boss_stonehold_fault_crowned_colossus/metallic.png",
          "bytes": 1079210,
          "sha256": "9e72ec30c011abfc4e97ec6bd2d55ca0342f23325a1f624a66b0dd6247ee358e",
          "dimensions": [
            2048,
            2048
          ],
          "mediaType": "image/png"
        },
        {
          "path": "Textures/boss_stonehold_fault_crowned_colossus/metallic_smoothness.png",
          "bytes": 2512741,
          "sha256": "21b91134b60acef939bec009733692bd08faa621dc2f4517e388f98aa0b37857",
          "dimensions": [
            2048,
            2048
          ],
          "mediaType": "image/png"
        },
        {
          "path": "Textures/boss_stonehold_fault_crowned_colossus/normal.png",
          "bytes": 5116058,
          "sha256": "712aef099a1a1f6231aa5b396ad99f650cd4170119fd96f997b26b9ede48cc6d",
          "dimensions": [
            2048,
            2048
          ],
          "mediaType": "image/png"
        },
        {
          "path": "Textures/boss_stonehold_fault_crowned_colossus/roughness.png",
          "bytes": 1125885,
          "sha256": "7f3d58ced707e3f440b084371efd44a67641c2d58d104918980d471bb500ba8a",
          "dimensions": [
            2048,
            2048
          ],
          "mediaType": "image/png"
        },
        {
          "path": "Textures/boss_stonehold_fault_crowned_colossus/runtime_2k/ao.png",
          "bytes": 6988,
          "sha256": "12c77e4a41a055f618d9aa992c2950d8366a5b2cb554644eac215f5e814c8358",
          "dimensions": [
            2048,
            2048
          ],
          "mediaType": "image/png"
        },
        {
          "path": "Textures/boss_stonehold_fault_crowned_colossus/runtime_2k/base_color.png",
          "bytes": 5466121,
          "sha256": "5493c23d9b71fe25102934663a6e448c888dc1ca4b2d3613b0fe6e2e793eea8c",
          "dimensions": [
            2048,
            2048
          ],
          "mediaType": "image/png"
        },
        {
          "path": "Textures/boss_stonehold_fault_crowned_colossus/runtime_2k/metallic_smoothness.png",
          "bytes": 2512741,
          "sha256": "21b91134b60acef939bec009733692bd08faa621dc2f4517e388f98aa0b37857",
          "dimensions": [
            2048,
            2048
          ],
          "mediaType": "image/png"
        },
        {
          "path": "Textures/boss_stonehold_fault_crowned_colossus/runtime_2k/normal.png",
          "bytes": 4098364,
          "sha256": "af0590568b4c319722bb5e7479899759716687600ecd888060f3ccb6779e7a28",
          "dimensions": [
            2048,
            2048
          ],
          "mediaType": "image/png"
        }
      ],
      "review": {
        "path": "Review/boss_stonehold_fault_crowned_colossus_threequarter.png",
        "bytes": 221467,
        "sha256": "fa17bd3703b705fd269cb37c0c4d361fe0fc3715da7a2d6de95fccacfe108cc2",
        "dimensions": [
          512,
          512
        ],
        "mediaType": "image/png"
      },
      "meshyTaskIds": [
        "01a05b45-c3f7-73cc-91dc-dd5b775afa7f"
      ],
      "rigged": false,
      "runtimeIntegrationState": "Blocked",
      "productionReady": false
    },
    {
      "source2dId": "tdf_elite_stonehold_oreblind_delver",
      "modelId": "elite_stonehold_oreblind_delver",
      "status": "clean_textured_base_pass",
      "blocker": null,
      "selectedSource": {
        "path": "Models/elite_stonehold_oreblind_delver/elite_stonehold_oreblind_delver_source_v001.fbx",
        "bytes": 13729612,
        "sha256": "df10a1ed7b48d3ccc0c87c0fd7c163f14be25f5e71c0c3a32de624a931534b2b"
      },
      "textures": [
        {
          "path": "Textures/elite_stonehold_oreblind_delver/ao.png",
          "bytes": 6988,
          "sha256": "12c77e4a41a055f618d9aa992c2950d8366a5b2cb554644eac215f5e814c8358",
          "dimensions": [
            2048,
            2048
          ],
          "mediaType": "image/png"
        },
        {
          "path": "Textures/elite_stonehold_oreblind_delver/base_color.png",
          "bytes": 5714313,
          "sha256": "f5fd986d860ae85370bccc3400cd72f87d0508a993341bdf0ff7d11fd8c0c01c",
          "dimensions": [
            2048,
            2048
          ],
          "mediaType": "image/png"
        },
        {
          "path": "Textures/elite_stonehold_oreblind_delver/metallic.png",
          "bytes": 13622,
          "sha256": "0f0239a1289428d34358f5e597fe114ab09da3f7d0e0a8a6bec5174a95b28cd5",
          "dimensions": [
            2048,
            2048
          ],
          "mediaType": "image/png"
        },
        {